<?xml version = "1.0" encoding="Windows-1252" standalone="yes"?>
<xsd:schema id="VFPData" xmlns:xsd="http://www.w3.org/2001/XMLSchema" xmlns:msdata="urn:schemas-microsoft-com:xml-msdata">
	<xsd:element name="VFPData" msdata:IsDataSet="true">
		<xsd:complexType>
			<xsd:choice maxOccurs="unbounded">
				<xsd:element name="suppliers" minOccurs="0" maxOccurs="unbounded">
					<xsd:complexType>
						<xsd:sequence>
							<xsd:element name="supplierid" type="xsd:int"/>
							<xsd:element name="supplier">
								<xsd:simpleType>
									<xsd:restriction base="xsd:string">
										<xsd:maxLength value="25"/>
									</xsd:restriction>
								</xsd:simpleType>
							</xsd:element>
							<xsd:element name="address" minOccurs="0">
								<xsd:simpleType>
									<xsd:restriction base="xsd:string">
										<xsd:maxLength value="2147483647"/>
									</xsd:restriction>
								</xsd:simpleType>
							</xsd:element>
							<xsd:element name="contactnam" minOccurs="0">
								<xsd:simpleType>
									<xsd:restriction base="xsd:string">
										<xsd:maxLength value="30"/>
									</xsd:restriction>
								</xsd:simpleType>
							</xsd:element>
							<xsd:element name="phone" minOccurs="0">
								<xsd:simpleType>
									<xsd:restriction base="xsd:string">
										<xsd:maxLength value="10"/>
									</xsd:restriction>
								</xsd:simpleType>
							</xsd:element>
							<xsd:element name="tin" minOccurs="0">
								<xsd:simpleType>
									<xsd:restriction base="xsd:string">
										<xsd:maxLength value="20"/>
									</xsd:restriction>
								</xsd:simpleType>
							</xsd:element>
						</xsd:sequence>
					</xsd:complexType>
				</xsd:element>
			</xsd:choice>
			<xsd:anyAttribute namespace="http://www.w3.org/XML/1998/namespace" processContents="lax"/>
		</xsd:complexType>
	</xsd:element>
</xsd:schema>
